[
  {
    "query_text": "ぴかぴかするイヤホン",
    "locale": "ja",
    "persona": "child",
    "user_intent": "光る完全ワイヤレスイヤホンを探している",
    "ideal_answer": "LEDが光る完全ワイヤレスイヤホン",
    "reason": "「ぴかぴか」はLED_LIGHT_UP属性への子ども特有の言い換え。formal属性辞書には存在しない表現。",
    "category": "earbuds",
    "search_terms": { "ja": ["光る イヤホン", "led 完全ワイヤレスイヤホン"], "en": ["light up wireless earbuds"], "ko": [], "zh": [] },
    "excluded_conditions": [],
    "confidence": 0.7,
    "authored_date": "2026-08-05",
    "authored_updated_date": "2026-08-05"
  },
  {
    "query_text": "ゲームにつなぐやつ",
    "locale": "ja",
    "persona": "child",
    "user_intent": "不明。ゲーム機本体・コントローラー・ケーブル・ヘッドセットのいずれも候補になり得る",
    "ideal_answer": "どのゲーム機とつなぎますか？（Switch/PS/スマホ など）コントローラーですか、それともイヤホン・ケーブルですか？",
    "reason": "product_typeを一意に確定できないultra_ambiguousな例。断定回答は誤答リスクが高く確認質問が正しい理想回答。",
    "category": "UNCLASSIFIED",
    "search_terms": { "ja": [], "en": [], "ko": [], "zh": [] },
    "excluded_conditions": [],
    "confidence": 0.3,
    "authored_date": "2026-08-05",
    "authored_updated_date": "2026-08-05"
  },
  {
    "query_text": "透明なやつ",
    "locale": "ja",
    "persona": "child",
    "user_intent": "不明。色属性(透明)しか手がかりがない",
    "ideal_answer": "透明な何をお探しですか？（スマホケース、傘、水筒 など）",
    "reason": "色属性のみでカテゴリ情報がゼロのultra_ambiguous例。確認質問が理想回答。",
    "category": "UNCLASSIFIED",
    "search_terms": { "ja": [], "en": [], "ko": [], "zh": [] },
    "excluded_conditions": [],
    "confidence": 0.2,
    "authored_date": "2026-08-05",
    "authored_updated_date": "2026-08-05"
  },
  {
    "query_text": "黒いイヤホン",
    "locale": "ja",
    "persona": "child",
    "user_intent": "黒色のイヤホンを探している",
    "ideal_answer": "黒色のイヤホン（有線・完全ワイヤレス問わず）",
    "reason": "色属性とカテゴリの両方が明確なrich例。有線/ワイヤレスの指定はないため両方許容。",
    "category": "earbuds",
    "search_terms": { "ja": ["黒 イヤホン", "ブラック イヤホン"], "en": ["black earbuds", "black earphones"], "ko": ["블랙 이어폰"], "zh": ["黑色耳机"] },
    "excluded_conditions": [],
    "confidence": 0.85,
    "authored_date": "2026-08-05",
    "authored_updated_date": "2026-08-05"
  },
  {
    "query_text": "テレビに映すやつ",
    "locale": "ja",
    "persona": "elderly",
    "user_intent": "スマホやPCの画面をテレビへ映したい。HDMIケーブル・変換アダプタ・キャスト端末のいずれかが候補",
    "ideal_answer": "お使いの機器は何ですか？HDMIケーブルで直接つなぎますか、それともWi-Fiで映す機器（Chromecast等）をお探しですか？",
    "reason": "手段（有線/無線）が不明なため断定は誤答リスクが高い。confidence低めのambiguous例。",
    "category": "UNCLASSIFIED",
    "search_terms": { "ja": [], "en": [], "ko": [], "zh": [] },
    "excluded_conditions": [],
    "confidence": 0.35,
    "authored_date": "2026-08-05",
    "authored_updated_date": "2026-08-05"
  },
  {
    "query_text": "充電する線",
    "locale": "ja",
    "persona": "elderly",
    "user_intent": "充電ケーブルを探している",
    "ideal_answer": "充電ケーブル（USBケーブル）",
    "reason": "「線」は高齢者層に多い「ケーブル」の言い換え。カテゴリはほぼ一意に確定できる。",
    "category": "cable",
    "search_terms": { "ja": ["充電ケーブル", "usbケーブル"], "en": ["charging cable", "usb cable"], "ko": ["충전 케이블"], "zh": ["充电线"] },
    "excluded_conditions": [],
    "confidence": 0.6,
    "authored_date": "2026-08-05",
    "authored_updated_date": "2026-08-05"
  },
  {
    "query_text": "軽い掃除機",
    "locale": "ja",
    "persona": "elderly",
    "user_intent": "軽量な掃除機を探している。高齢者は重量が購入基準の中心",
    "ideal_answer": "軽量なコードレス掃除機",
    "reason": "カテゴリ・属性(軽量)ともに明確。「軽い」は既存辞書のsize系属性と統合可能。",
    "category": "vacuum",
    "search_terms": { "ja": ["軽量 掃除機", "軽い コードレス掃除機"], "en": ["lightweight vacuum cleaner"], "ko": ["가벼운 청소기"], "zh": ["轻量吸尘器"] },
    "excluded_conditions": ["重い", "業務用"],
    "confidence": 0.75,
    "authored_date": "2026-08-05",
    "authored_updated_date": "2026-08-05"
  },
  {
    "query_text": "sumaho keesu iphone 15",
    "locale": "mixed",
    "persona": "foreign",
    "user_intent": "iPhone 15用のスマホケースを探している（ローマ字入力）",
    "ideal_answer": "iPhone 15専用スマホケース",
    "reason": "「sumaho keesu」はローマ字表記の「スマホケース」。日本語入力に不慣れな利用者を想定した例。",
    "category": "phone-case",
    "search_terms": { "ja": ["iphone 15 ケース", "iphone15 スマホケース"], "en": ["iphone 15 case"], "ko": ["아이폰15 케이스"], "zh": ["iphone 15 手机壳"] },
    "excluded_conditions": [],
    "confidence": 0.65,
    "authored_date": "2026-08-05",
    "authored_updated_date": "2026-08-05"
  },
  {
    "query_text": "투명 iphone 케이스 15",
    "locale": "ko",
    "persona": "foreign",
    "user_intent": "iPhone 15用の透明なケースを探している（韓国語）",
    "ideal_answer": "iPhone 15用の透明なスマホケース",
    "reason": "韓国語母語話者の検索例。透明(투명)とiPhone 15の互換属性が明確なrich例。",
    "category": "phone-case",
    "search_terms": { "ja": ["iphone 15 透明ケース", "クリアケース iphone15"], "en": ["clear case iphone 15"], "ko": ["아이폰15 투명 케이스"], "zh": ["iphone 15 透明壳"] },
    "excluded_conditions": [],
    "confidence": 0.8,
    "authored_date": "2026-08-05",
    "authored_updated_date": "2026-08-05"
  }
]
